"序号","审核点名称","审核要求","检查结果","结论说明","证据位置","证据摘录"
"1","项目经理高级职称要求","须提供项目经理具备高级工程师职称的证明。","已找到明确证据","候选文字明确记载项目经理及高级工程师职称。 引用第 1 页候选证据。 请人工核对职称材料的完整性及适用范围。","synthetic_proposal_text_layer.pdf > 第 1 页","合成示例：本文所有主体、人员、证书和项目内容均为虚构，不对应任何真实客户、投标活动或个人。  项目经理：张小鹿（虚构人员）  职称：高级工程师（合成字段）  经验：8 年以上智慧运维平台实施经验（合成描述）  社保证明：已提供近 6 个月连续社保证明（合成描述） 备注：以上人员与公司不存在真实对应关系，仅为合成示例；文档未附任何真实身份证明、证书、 签章或客户材料。"
"2","项目经理社保证明要求","须提供项目经理近 6 个月连续社保证明。","已找到明确证据","候选文字明确记载近 6 个月连续社保证明。 引用第 1 页候选证据。 请人工核对月份连续性及人员对应关系。","synthetic_proposal_text_layer.pdf > 第 1 页","合成示例：本文所有主体、人员、证书和项目内容均为虚构，不对应任何真实客户、投标活动或个人。  项目经理：张小鹿（虚构人员）  职称：高级工程师（合成字段）  经验：8 年以上智慧运维平台实施经验（合成描述）  社保证明：已提供近 6 个月连续社保证明（合成描述） 备注：以上人员与公司不存在真实对应关系，仅为合成示例；文档未附任何真实身份证明、证书、 签章或客户材料。"
"3","售后服务响应要求","P1 级故障须 30 分钟内响应。","已找到明确证据","候选文字明确记载 P1 级故障 30 分钟内响应。 引用第 2 页候选证据。 请人工核对故障定义和响应计时口径。","synthetic_proposal_text_layer.pdf > 第 2 页","合成示例：本文所有主体、人员、证书和项目内容均为虚构，不对应任何真实客户、投标活动或个人。  提供 7×24 小时服务热线（合成服务承诺）。  P1 级故障 30 分钟内响应（合成响应时限）。  4 小时内提交初步处置方案（合成处置安排）。  提供不少于 3 年免费软件升级服务（合成服务期限）。 说明：以上服务内容仅用于验证文字检索与人工复核流程，不构成任何真实主体的服务承诺。"
"4","免费升级服务要求","须承诺不少于 3 年免费软件升级服务。","已找到明确证据","候选文字明确记载不少于 3 年免费软件升级服务。 引用第 2 页候选证据。 请人工核对免费服务范围及起算时间。","synthetic_proposal_text_layer.pdf > 第 2 页","合成示例：本文所有主体、人员、证书和项目内容均为虚构，不对应任何真实客户、投标活动或个人。  提供 7×24 小时服务热线（合成服务承诺）。  P1 级故障 30 分钟内响应（合成响应时限）。  4 小时内提交初步处置方案（合成处置安排）。  提供不少于 3 年免费软件升级服务（合成服务期限）。 说明：以上服务内容仅用于验证文字检索与人工复核流程，不构成任何真实主体的服务承诺。"
"5","信息安全管理体系认证","须提供信息安全管理体系认证证书及有效期。","已找到明确证据","候选表格文字包含信息安全管理体系认证证书及有效期。 引用第 3 页候选证据。 请人工核对合成证书字段的对应关系。","synthetic_proposal_text_layer.pdf > 第 3 页","下表中的证书名称、编号、有效期和认证范围全部为合成字段，不代表任何真实认证状态。 证书名称 证书编号 有效期 认证范围 信息安全管理体系认证证书 SYN-ISO27001-20262028年12月31日 智慧运维平台研发与服务 质量管理体系认证证书 SYN-ISO9001-20262028年12月31日 软件开发与技术服务 合成声明：表中 SYN 前缀编号专为本 demo 构造，不对应真实证书；本页不含证书影像、签章或二 维码。 合成示例 · 第 3 页 · 仅供公开演示与回归验证"
"6","质量管理体系认证","须提供质量管理体系认证证书及有效期。","已找到明确证据","候选表格文字包含质量管理体系认证证书及有效期。 引用第 3 页候选证据。 请人工核对合成证书字段的对应关系。","synthetic_proposal_text_layer.pdf > 第 3 页","下表中的证书名称、编号、有效期和认证范围全部为合成字段，不代表任何真实认证状态。 证书名称 证书编号 有效期 认证范围 信息安全管理体系认证证书 SYN-ISO27001-20262028年12月31日 智慧运维平台研发与服务 质量管理体系认证证书 SYN-ISO9001-20262028年12月31日 软件开发与技术服务 合成声明：表中 SYN 前缀编号专为本 demo 构造，不对应真实证书；本页不含证书影像、签章或二 维码。 合成示例 · 第 3 页 · 仅供公开演示与回归验证"
"7","交付周期要求","须承诺 90 个自然日内完成终验资料提交。","已找到明确证据","候选文字明确记载 90 个自然日内完成终验资料提交。 引用第 4 页候选证据。 请人工核对各里程碑之间的时间关系。","synthetic_proposal_text_layer.pdf > 第 4 页","合成示例：本文所有主体、人员、证书和项目内容均为虚构，不对应任何真实客户、投标活动或个人。  合同签订后 10 个自然日内完成项目启动（合成计划）。  30 个自然日内完成系统部署（合成计划）。  60 个自然日内完成试运行（合成计划）。  90 个自然日内完成终验资料提交（合成计划）。 说明：以上周期仅为回归验证所需的合成时间线，不对应任何真实合同、客户或实施项目。"
"8","驻场服务人员要求","须提供 2 名长期驻场服务人员名单。","未找到证据","未检索到与长期现场服务人员名单对应的候选文字。 候选证据列表为空。 请人工复核全文及附件目录。","",""
